{
  "capabilities": [],
  "connections": [],
  "controls": [
    {
      "configCapabilities": [],
      "controlId": "key.0.0",
      "diagnosticCapabilities": [],
      "geometry": {
        "height": 1.0,
        "unit": "grid",
        "width": 1.0,
        "x": 0.0,
        "y": 0.0
      },
      "inputCapabilities": [
        {
          "access": [
            "emits"
          ],
          "capabilityId": "button.press",
          "commandTypes": [],
          "constraints": [],
          "direction": "input",
          "eventTypes": [
            "press"
          ],
          "family": "dev.deckr.input.button",
          "sources": [],
          "type": "activation",
          "units": [],
          "valueSchema": {
            "schema": {
              "additionalProperties": false,
              "properties": {
                "eventType": {
                  "const": "press"
                }
              },
              "required": [
                "eventType"
              ],
              "type": "object"
            },
            "schemaId": "dev.deckr.value.input.button.activation.v1"
          }
        }
      ],
      "kind": "key",
      "outputCapabilities": [
        {
          "access": [
            "settable",
            "invokable"
          ],
          "capabilityId": "raster.bitmap",
          "commandSchema": {
            "schema": {
              "oneOf": [
                {
                  "additionalProperties": false,
                  "properties": {
                    "encoding": {
                      "enum": [
                        "jpeg",
                        "png"
                      ]
                    },
                    "height": {
                      "const": 72
                    },
                    "image": {
                      "contentEncoding": "base64",
                      "type": "string"
                    },
                    "width": {
                      "const": 72
                    }
                  },
                  "required": [
                    "image",
                    "encoding"
                  ],
                  "type": "object"
                },
                {
                  "maxProperties": 0,
                  "type": "object"
                }
              ]
            },
            "schemaId": "dev.deckr.command.output.raster.bitmap.v1"
          },
          "commandTypes": [
            "set_frame",
            "clear"
          ],
          "constraints": [],
          "direction": "output",
          "eventTypes": [],
          "family": "dev.deckr.output.raster",
          "sources": [],
          "type": "bitmap",
          "units": []
        }
      ],
      "relatedControlIds": [],
      "sources": [],
      "stateCapabilities": []
    }
  ],
  "deviceId": "deck-1",
  "displayName": "Example Deck",
  "fingerprint": "fingerprint:deck-1",
  "identifiers": [],
  "manufacturer": "Deckr",
  "model": "Fixture Panel",
  "sources": []
}
